{
  "$schema": "https://json-schema.org/draft/2020-12/schema",
  "$id": "https://gembo.invalid/agents/schemas/verification-task/1.0.0",
  "title": "verification-task v1.0.0",
  "type": "object",
  "properties": {
    "schema_version": {
      "const": "1.0.0"
    },
    "task_id": {
      "type": "string",
      "pattern": "^[a-z0-9][a-z0-9-]{0,95}$"
    },
    "run_id": {
      "type": "string",
      "pattern": "^[a-z0-9][a-z0-9-]{0,95}$"
    },
    "repository": {
      "const": {
        "id": 1186938709,
        "full_name": "zeroclap/gembo"
      }
    },
    "issue_url": {
      "type": [
        "string",
        "null"
      ],
      "pattern": "^https://github.com/zeroclap/gembo/issues/[1-9][0-9]*$"
    },
    "role": {
      "const": "verification"
    },
    "role_version": {
      "const": "1.0.0"
    },
    "tool_version": {
      "const": "verification-contract/1.0.0"
    },
    "authority": {
      "const": "contract-rehearsal"
    },
    "base_commit": {
      "type": "string",
      "pattern": "^[a-f0-9]{40}$"
    },
    "objective": {
      "type": "string",
      "minLength": 1,
      "maxLength": 4096
    },
    "acceptance_criteria": {
      "type": "array",
      "items": {
        "type": "string",
        "minLength": 1,
        "maxLength": 4096
      },
      "minItems": 1,
      "maxItems": 16
    },
    "risk": {
      "const": "R0"
    },
    "environment": {
      "const": "evidence-only"
    },
    "trusted_bundle": {
      "type": "array",
      "items": {
        "type": "object",
        "properties": {
          "path": {
            "type": "string",
            "pattern": "^(?!/)(?!.*\\.\\.)(?!.*\\\\)[A-Za-z0-9_./-]+$",
            "maxLength": 256
          },
          "sha256": {
            "type": "string",
            "pattern": "^[a-f0-9]{64}$"
          }
        },
        "required": [
          "path",
          "sha256"
        ],
        "additionalProperties": false
      },
      "minItems": 6,
      "maxItems": 6,
      "uniqueItems": true
    },
    "inputs": {
      "type": "array",
      "items": {
        "type": "object",
        "properties": {
          "path": {
            "type": "string",
            "pattern": "^(?!/)(?!.*\\.\\.)(?!.*\\\\)[A-Za-z0-9_./-]+$",
            "maxLength": 256
          },
          "sha256": {
            "type": "string",
            "pattern": "^[a-f0-9]{64}$"
          }
        },
        "required": [
          "path",
          "sha256"
        ],
        "additionalProperties": false
      },
      "minItems": 1,
      "maxItems": 1
    },
    "scope": {
      "type": "object",
      "properties": {
        "read_paths": {
          "type": "array",
          "items": {
            "type": "string",
            "pattern": "^(?!/)(?!.*\\.\\.)(?!.*\\\\)[A-Za-z0-9_./-]+$",
            "maxLength": 256
          },
          "minItems": 7,
          "maxItems": 7,
          "uniqueItems": true
        },
        "output_path": {
          "type": "string",
          "pattern": "^(?!/)(?!.*\\.\\.)(?!.*\\\\)[A-Za-z0-9_./-]+$",
          "maxLength": 256
        }
      },
      "required": [
        "read_paths",
        "output_path"
      ],
      "additionalProperties": false
    },
    "allowed_command_ids": {
      "const": [
        "review-d02"
      ]
    },
    "budgets": {
      "const": {
        "max_wall_seconds": 1800,
        "max_attempts": 1,
        "max_input_bytes": 1048576,
        "max_output_bytes": 1048576,
        "max_model_tokens": 12000,
        "max_tool_calls": 40,
        "max_additional_cost_usd": "0.00",
        "network_requests": 0
      }
    },
    "deadline": {
      "type": "string",
      "pattern": "^\\d{4}-\\d{2}-\\d{2}T\\d{2}:\\d{2}:\\d{2}(\\.\\d+)?\\+00:00$"
    },
    "approval_refs": {
      "const": []
    },
    "publisher_target": {
      "type": "null"
    },
    "gembo_cli": {
      "const": {
        "status": "not-implemented",
        "allowed_commands": []
      }
    }
  },
  "required": [
    "schema_version",
    "task_id",
    "run_id",
    "repository",
    "issue_url",
    "role",
    "role_version",
    "tool_version",
    "authority",
    "base_commit",
    "objective",
    "acceptance_criteria",
    "risk",
    "environment",
    "trusted_bundle",
    "inputs",
    "scope",
    "allowed_command_ids",
    "budgets",
    "deadline",
    "approval_refs",
    "publisher_target",
    "gembo_cli"
  ],
  "additionalProperties": false
}
