{
  "schema_version": "1.0.0",
  "task_id": "d03-review-d02",
  "run_id": "d03-20261029t074717z-652eee9a",
  "repository": {
    "id": 1186938709,
    "full_name": "zeroclap/gembo"
  },
  "issue_url": null,
  "role": "verification",
  "role_version": "1.0.0",
  "tool_version": "verification-contract/1.0.0",
  "authority": "contract-rehearsal",
  "base_commit": "158eeaaa27eea6858e0e0bf081cd5c30d4d2b2b0",
  "objective": "Review all recorded D02 checks without rerunning application or exchange commands.",
  "acceptance_criteria": [
    "Retain all 21 imported checks and original provenance.",
    "Preserve failures, skips, not-run checks and explicit unknowns.",
    "Validate the task/result contract without granting operating authority."
  ],
  "risk": "R0",
  "environment": "evidence-only",
  "trusted_bundle": [
    {
      "path": "agents/roles/verification.md",
      "sha256": "947a4bdad67a46117085b18eef80f73028ec99ccd98132dd533f8114d00ffd94"
    },
    {
      "path": "agents/policies/verification.json",
      "sha256": "658abdaab13bc2931566982f4017c330f491daf842af7b70b2a07da83098b4a5"
    },
    {
      "path": "agents/schemas/verification-task.schema.json",
      "sha256": "f3c08b917f67de3ac3c6a2c8008430a8c96dcfe85f07e8ee98bded3ac611e468"
    },
    {
      "path": "agents/schemas/verification-result.schema.json",
      "sha256": "b6d923e327a9a21f775ebb732af2763dd95beb570c3fab9d0d344e3f4dabb1e6"
    },
    {
      "path": "scripts/verification/contract.py",
      "sha256": "bafbe6da053fd7ed0a0dffe9a92534c1d2f2a2da1180811055353703a458072d"
    },
    {
      "path": "tools/verification/contract-requirements.txt",
      "sha256": "b41f5e1c575082b07952e8cc81de8ea702f1efefbc2abcb6c3290f375a5731c3"
    }
  ],
  "inputs": [
    {
      "path": "docs/reports/d02-baseline.json",
      "sha256": "9900e8b0d2790edd5a00147022cd3f2e855f6fec0f439ef998c86a2153d77d69"
    }
  ],
  "scope": {
    "read_paths": [
      "agents/roles/verification.md",
      "agents/policies/verification.json",
      "agents/schemas/verification-task.schema.json",
      "agents/schemas/verification-result.schema.json",
      "scripts/verification/contract.py",
      "tools/verification/contract-requirements.txt",
      "docs/reports/d02-baseline.json"
    ],
    "output_path": "docs/reports/d03-verification-result.json"
  },
  "allowed_command_ids": [
    "review-d02"
  ],
  "budgets": {
    "max_wall_seconds": 1800,
    "max_attempts": 1,
    "max_input_bytes": 1048576,
    "max_output_bytes": 1048576,
    "max_model_tokens": 12000,
    "max_tool_calls": 40,
    "max_additional_cost_usd": "0.00",
    "network_requests": 0
  },
  "deadline": "2026-10-29T08:17:17.574068+00:00",
  "approval_refs": [],
  "publisher_target": null,
  "gembo_cli": {
    "status": "not-implemented",
    "allowed_commands": []
  }
}
